job_title,company,location,job_type,job_snippet,salary,company_rating,href
"Associate Director, SEO (Remote - Mexico)",Directive,Mexico,Full Time,"For this role, we want you, the Associate Director, SEO from our dreams, to elevate your team's SEO campaigns via purposeful leadership and a focus on innovative campaigns that blend traditional SEO with creative content experiences to fuel product-led growth. This role reports to the Director of SEO and is a crucial part of the SEO team. The Associate Director oversees a small team of Account Strategists and is responsible for helping their team succeed in providing world-class strategies and results for their portfolio of clients. In this role you will gain experience managing, developing, motivating, and challenging experienced Account Strategists to be the best version of themselves. 5+ years experience in SEO (preferably in an agency environment)
 Experience managing a team
 Ability to motivate those around you to be the best versions of themselves
 Ability to drive strategic conversation around the pillars of SEO (e.g. Content, Technical, etc.) and how they map to business challenges
 Ability to drive revenue through SEO and measure via GA and other analytics tools
 Experience with top SEO tools: ahrefs, semrush, screaming frog, etc. 
 Ability to translate and articulate strategy and tell stories with data
 Proven and measurable success with mid-market or enterprise accounts
 A unique perspective on how to drive value for Tech and SaaS
 Equal parts competitive and curious; you're a true problem solver
 You live on the cutting edge of the industry, always looking for opportunities to grow and share
 Ability to organize, prioritize and manage multiple projects simultaneously
 You're quality-obsessed and have not lost your soul for SEO
 Exceptional decision making, as it relates to strategic direction for your team",N/A,N/A,https://directiveconsulting.com/
Software Engineer Internship 2023,Basis Technologies,UnitedStates,Internship,"Basis Technologies' Summer Internship Program will teach you more about our industry, company, and the departments that make it all possible. This project-based role will require you to bring your unique perspective to the team. Learning from some of the smartest people in the business, we expect you to take full advantage of the resources we have to make Basis better. In this role, you will work with a manager and mentor to guide you through the exciting summer ahead of you, digging deep into the day-to-day work of our full-time employees. Working directly with the Product Team and business stakeholders to turn requirements into shippable deliverables, collaborating with developers, designers, product managers, and testers to build great solutions to complex digital advertising problems.
Teams offering internships:
1. Software Engineering - Automation and Test Working towards a degree in Computer Science or a similar field and graduating in 2023 or 2024
 Ability to accept a full-time position at the end of the internship
 Passionate about design, architecture, coding standards and testing
 Experience with an Object-Oriented language, bonus points for Ruby, Java
 Familiarity with relational databases, bonus points for PostgreSQL
 Desire to learn and grow as a software engineer
 Involvement in the development community and personal projects outside of class is a plus
 Hands on experience in teams collaborating using Git (or similar source control)",$30 - $37 / year,N/A,https://basis.net/
"HR Coordinator - US, Central or Eastern Region",Guidewire Software,UnitedStates,Full Time," Serve as a crucial partner to the HR Business Partner and Generalist team by coordinating and documenting talent management activities
 Be the first point of contact for employees with HR-related questions and concerns
 Provide operational support by ensuring accurate and timely data is provided to HR Ops/Payroll teams, administering employee changes, and maintaining employee documentation
 Leverage Workday reports and dashboards to prepare staffing and turnover updates
 Assist with various projects and administrative tasks, and ensure compliance with employment laws and regulations 1-2 years of HR knowledge and/or related experience
 Demonstrated ability to work in a customer service-oriented environment
 Highly experienced in MS Office and/or Google Workplace, with a focus on Excel and/or Google Sheets
 Excellent written and verbal communication skills
 Detail-oriented with strong analytical skills
 Familiarity with payroll and employment law and regulations
 Bachelor's degree in human resources or related field is a plus",$51k - $77k / year,N/A,https://careers.guidewire.com/
People Operations Coordinator,Lyra Health,UnitedStates,Full Time,"The People Operations Coordinator role is a hands-on role that provides exceptional employee customer support as the representative for day-to-day HR inquiries. This role is ideal for someone who is looking for broad exposure to HR and wants to grow with a quickly scaling organization. You'll contribute to the ongoing evolution of the People team by serving as the main administrative point of contact for areas such as onboarding, the employee lifecycle, HR support, and compliance. This individual will join during an exciting time on the People Team as we recently transitioned to Workday HRIS for the entire organization! This individual will play a critical role in this system transformation. Bachelor's Degree and 1-2 years of professional experience in an HR, administrative, or similar role
 Experience using an HRIS (Human Resources Information System); Workday experience is a plus
 Strong analytical, written, and verbal communication skills
 Strong attention to detail
 Project management experience is a plus!
 Great team player with a collaborative mindset
 Thoughtfulness, flexibility, and a positive attitude
 Fluent in Google Apps and MS Office",$25 - $39 / year,N/A,https://www.lyrahealth.com/
